{
  "schema_version": "1.0.0",
  "register_id": "ressourcenregister",
  "letzte_aenderung": "2026-05-16T03:12:35.494680+00:00",
  "eintraege": [
    {
      "resource_id": "TESS_DEU",
      "typ": "ocr_sprachpaket",
      "sprache": "de",
      "land": "DE",
      "rechtsraum": "Bundesrepublik Deutschland",
      "rechtsgebiet": "Allgemein",
      "dokumenttyp": "Allgemein",
      "pfad": "",
      "status": "freigegeben",
      "offline_verfuegbar": true,
      "online_erforderlich": false,
      "fallback": "",
      "letzte_pruefung": "2026-05-16T03:12:35.494680+00:00",
      "warnungen": [
        "Durch Inventarisierung ermittelt."
      ]
    },
    {
      "resource_id": "TESS_SWE",
      "typ": "ocr_sprachpaket",
      "sprache": "sv",
      "land": "SE",
      "rechtsraum": "Schweden",
      "rechtsgebiet": "Arbeitsrecht",
      "dokumenttyp": "Arbeitsvertrag",
      "pfad": "",
      "status": "freigegeben",
      "offline_verfuegbar": true,
      "online_erforderlich": false,
      "fallback": "TESS_DEU",
      "letzte_pruefung": "2026-05-16T03:12:35.494680+00:00",
      "warnungen": [
        "Durch Inventarisierung ermittelt."
      ]
    }
  ]
}
